{
  "api_version": "experiments.fips.network/release-audit/v1alpha1",
  "release": "0.1.0",
  "determinism": {
    "repetitions": 3,
    "artifact_sha256": "b9b84cceaa7c8f8299e923d47cc74d1a09706f04b25db7918570926d93e63b4e",
    "analysis_sha256": "6f8ce9d3e622dc3f55d2b2f47f5ac410bd1708c9704d02f639de6999b5973c65",
    "atlas_sha256": "a17e51b4ef1372d42be25aa796a445b13fd8108b2150ccbf94afe644d35640d9",
    "dimensions": [
      {
        "dimension": "operating-system",
        "values": [
          "Linux",
          "macOS"
        ],
        "policy": "canonical evidence must match in CI"
      },
      {
        "dimension": "architecture",
        "values": [
          "x86_64",
          "aarch64"
        ],
        "policy": "integer semantic evidence must match"
      },
      {
        "dimension": "worker-count",
        "values": [
          "1",
          "2",
          "4"
        ],
        "policy": "stable scheduler ordering is worker-independent"
      },
      {
        "dimension": "toolchain",
        "values": [
          "1.85 minimum",
          "stable"
        ],
        "policy": "schema and semantic evidence must match"
      }
    ],
    "numeric_policy": "protocol semantics use integer units and require exact equality; calibrated statistical outputs compare declared bounds, never hidden float tolerances",
    "passed": true
  },
  "accounting": {
    "fidelity": "Wire evidence uses executable production codec; protocol fidelity is individually modeled semantic state; compute fidelity is operation-counted compute; scale uses individual nodes across 12 represented nodes; Bloom fidelity uses exact Bloom bits. No approximation metadata applies.",
    "stage_totals": {
      "coalesced": 8,
      "compute": 417,
      "constructed": 165,
      "delivered": 185524,
      "fmp": 135288,
      "fsp": 9432,
      "identity-generation-operations": 4,
      "lower-bound": 140608,
      "network": 140608,
      "payload": 24576,
      "performed": 81,
      "queued": 180904,
      "requested": 201,
      "serialized": 175584,
      "signed": 165,
      "state": 2128,
      "state-mutated": 24696,
      "superseded": 8,
      "time": 6601516800,
      "transmitted": 185524,
      "transport": 5320,
      "useful-payload": 24576
    },
    "projections": [
      {
        "name": "serialized frame bytes",
        "observed": 175584,
        "unit": "bytes",
        "status": "reconciled",
        "evidence": "causal ledger and executable frame evidence"
      },
      {
        "name": "transmitted wire bytes",
        "observed": 185524,
        "unit": "bytes",
        "status": "reconciled",
        "evidence": "per-edge transmitted equals delivered plus lost"
      },
      {
        "name": "useful payload",
        "observed": 24576,
        "unit": "bytes",
        "status": "reconciled",
        "evidence": "application payload excludes protocol framing"
      },
      {
        "name": "resource work",
        "observed": 417,
        "unit": "units",
        "status": "reconciled",
        "evidence": "each executed work item has a resource receipt"
      }
    ],
    "exclusions": [
      "lower-layer host networking not represented by configured transport overhead",
      "daemon metrics absent from telemetry remain unobserved"
    ],
    "unobserved": [
      "host scheduler CPU time",
      "allocator peak RSS"
    ],
    "passed": true
  },
  "support_matrix": [
    {
      "surface": "macOS arm64/x86_64 CLI",
      "status": "supported",
      "evidence": "CI plus clean-install script"
    },
    {
      "surface": "Linux arm64/x86_64 CLI",
      "status": "supported",
      "evidence": "CI plus release matrix"
    },
    {
      "surface": "static analysis browser",
      "status": "supported",
      "evidence": "local-file and static-export tests"
    },
    {
      "surface": "Windows",
      "status": "unsupported",
      "evidence": "not in v0.1 build or determinism matrix"
    },
    {
      "surface": "real Tor/Nym/BLE calibration",
      "status": "unsupported",
      "evidence": "abstract transport only"
    }
  ],
  "threat_controls": [
    "artifact size limits and schema validation",
    "relative normalized bundle paths only",
    "no plugin execution in the analysis browser",
    "container harness has explicit network and host boundaries",
    "release bundles exclude secrets and host paths"
  ],
  "limitations": [
    "daemon agreement is limited to metrics exposed by the pinned harness",
    "one-billion-node results are cohort or hybrid, never individual",
    "calibrated performance applies only to its recorded hardware profile"
  ],
  "ready": true
}
